[
  {
    "id": 1,
    "name": "Sencha",
    "origin": "Japan",
    "category": "Green",
    "preparation": "Steep in hot water at 75-80°C for 1-2 minutes",
    "taste": "Fresh, grassy, slightly sweet",
    "caffeine_mg": 30,
    "brew_time_minutes": 1.5,
    "temperature_celsius": 80,
    "image": "https://upload.wikimedia.org/wikipedia/commons/4/40/Sencha_tea.jpg",
    "notes": "Most popular green tea in Japan"
  },
  {
    "id": 2,
    "name": "Darjeeling",
    "origin": "India",
    "category": "Black",
    "preparation": "Steep in boiling water for 3-4 minutes",
    "taste": "Floral, fruity, delicate",
    "caffeine_mg": 40,
    "brew_time_minutes": 4,
    "temperature_celsius": 100,
    "image": "https://upload.wikimedia.org/wikipedia/commons/1/19/Darjeeling_tea_leaves.jpg",
    "notes": "Known as the 'Champagne of teas'"
  },
  {
    "id": 3,
    "name": "White Peony (Bai Mudan)",
    "origin": "China",
    "category": "White",
    "preparation": "Steep in water at 80°C for 4-5 minutes",
    "taste": "Mild, sweet, floral",
    "caffeine_mg": 15,
    "brew_time_minutes": 4.5,
    "temperature_celsius": 80,
    "image": "https://upload.wikimedia.org/wikipedia/commons/5/5e/White_Peony_tea.jpg",
    "notes": "One of the most popular white teas"
  },
  {
    "id": 4,
    "name": "Tieguanyin",
    "origin": "China",
    "category": "Oolong",
    "preparation": "Steep in 90°C water for 3-5 minutes",
    "taste": "Floral, creamy, complex",
    "caffeine_mg": 30,
    "brew_time_minutes": 4,
    "temperature_celsius": 90,
    "image": "https://upload.wikimedia.org/wikipedia/commons/e/e5/Tieguanyin_tea_leaves.jpg",
    "notes": "A famous Chinese oolong tea"
  },
  {
    "id": 5,
    "name": "Pu-erh",
    "origin": "China",
    "category": "Pu-erh",
    "preparation": "Steep in boiling water for 2-4 minutes",
    "taste": "Earthy, mellow, rich",
    "caffeine_mg": 20,
    "brew_time_minutes": 3,
    "temperature_celsius": 100,
    "image": "https://upload.wikimedia.org/wikipedia/commons/3/3b/Pu-erh_tea_cake.jpg",
    "notes": "Fermented tea with aging potential"
  },
  {
    "id": 6,
    "name": "Rooibos",
    "origin": "South Africa",
    "category": "Rooibos",
    "preparation": "Steep in boiling water for 5-7 minutes",
    "taste": "Sweet, nutty, slightly fruity",
    "caffeine_mg": 0,
    "brew_time_minutes": 6,
    "temperature_celsius": 100,
    "image": "https://upload.wikimedia.org/wikipedia/commons/4/48/Rooibos_tea.jpg",
    "notes": "Naturally caffeine-free herbal tea"
  },
  {
    "id": 7,
    "name": "Yellow Tea",
    "origin": "China",
    "category": "Yellow",
    "preparation": "Steep in 75-80°C water for 3-4 minutes",
    "taste": "Smooth, mellow, slightly sweet",
    "caffeine_mg": 25,
    "brew_time_minutes": 3.5,
    "temperature_celsius": 80,
    "image": "https://upload.wikimedia.org/wikipedia/commons/7/74/Yellow_Tea_Leaves.jpg",
    "notes": "Rare and prized tea variety"
  },
  {
    "id": 8,
    "name": "Chamomile",
    "origin": "Egypt",
    "category": "Herbal",
    "preparation": "Steep in boiling water for 5-6 minutes",
    "taste": "Sweet, floral, calming",
    "caffeine_mg": 0,
    "brew_time_minutes": 5.5,
    "temperature_celsius": 100,
    "image": "https://upload.wikimedia.org/wikipedia/commons/3/33/Chamomile_tea.jpg",
    "notes": "Popular herbal infusion for relaxation"
  },
  {
    "id": 9,
    "name": "Jasmine Green Tea",
    "origin": "China",
    "category": "Green",
    "preparation": "Steep in 75-80°C water for 2-3 minutes",
    "taste": "Floral, fragrant, sweet",
    "caffeine_mg": 30,
    "brew_time_minutes": 2.5,
    "temperature_celsius": 80,
    "image": "https://upload.wikimedia.org/wikipedia/commons/f/f7/Jasmine_tea.jpg",
    "notes": "Green tea scented with jasmine flowers"
  },
  {
    "id": 10,
    "name": "Assam",
    "origin": "India",
    "category": "Black",
    "preparation": "Steep in boiling water for 3-5 minutes",
    "taste": "Malty, strong, brisk",
    "caffeine_mg": 50,
    "brew_time_minutes": 4,
    "temperature_celsius": 100,
    "image": "https://upload.wikimedia.org/wikipedia/commons/a/a9/Assam_tea.jpg",
    "notes": "Robust black tea from Assam region"
  }
]
